<?xml version="1.0" encoding="UTF-8"?>
<!DOCTYPE contentList SYSTEM "BitTorrentTracker.dtd">
<contentList>
   <content name="test1">
      <numOfPieces>80</numOfPieces>
      <numOfSubPieces>8</numOfSubPieces>
      <subPieceSize>32768</subPieceSize>
   </content>
   <content name="test_simple">
      <numOfPieces>10</numOfPieces>
      <numOfSubPieces>8</numOfSubPieces>
      <subPieceSize>32768</subPieceSize>
   </content>
</contentList>
